{
  "# CONSTRAINT TRADE-OFF": "JSON does not support comments; required file header metadata and trade-off annotations are encoded as reserved keys.",
  "__file": "pipeline/pac-evaluator-input.json",
  "__role": "Schema-bound evaluator input payload with canonical repository paths.",
  "__constraints_enforced": [
    "static-path-contract",
    "pipeline-run-reference-injection",
    "immutable-policy-input-reference"
  ],
  "__upstream": "evaluate-policies",
  "__downstream": "policies/pac-evaluator.js",
  "$schema": "../schemas/pac-evaluator-input.schema.json",
  "policy_file_path": "policies/pac-policy.json",
  "policy_schema_path": "schemas/pac-policy.schema.json",
  "policy_dir_path": "policies",
  "conftest_input_path": "pipeline/outputs/pac-conftest-input.json",
  "output_path": "pipeline/outputs/pac-evaluation-result.json",
  "pipeline_run_ref": "INJECTED_FROM_PIPELINE_CONTEXT"
}
